{"actual_read_set":[{"artifact_id":"artifact_01j00000000000000000000001","content_hash":"def81af2ea85a2bb3ce0c0e49607aeccceb25734ad5b64cf978b6697d0a56c75","content_hash_algorithm":"sha256","event_id":"event_01j00000000000000000000004","record_id":"record_01j00000000000000000000001","relative_path":"examples/execution_contract/synthetic_run/artifacts/input.json"}],"actual_write_set":[{"artifact_id":"artifact_01j00000000000000000000002","content_hash":"94c42a41e538829a75fa1cab004620b00f7cb36a7c315dba4bb2f93c6856853a","content_hash_algorithm":"sha256","event_id":"event_01j00000000000000000000005","record_id":null,"relative_path":"examples/execution_contract/synthetic_run/artifacts/output.json"}],"agent_profile_version":"video_intake_agent_v1.0.0","agent_runtime_version":"synthetic-runtime-1","attempt_no":1,"bootstrap_refs":[{"description":"stage-three public implementation seal","object_id":"8c64bc910168e4212f081cdcc0ac2099738dcd3a","ref_type":"git_commit"},{"description":"stage-three public tree","object_id":"bcd5ef0545d7796fa8af15ecf29186f118742e9e","ref_type":"git_tree"},{"content_hash":"47bba36d142f2ad1e7f406015d2117f8d720b971607016d3db21a44b7f02ded8","content_hash_algorithm":"sha256","purpose":"bounded synthetic code and input surface","ref_type":"working_tree_manifest","relative_path":"examples/execution_contract/synthetic_run/working_tree_manifest.json"},{"content_hash":"e14161e9824f479d806ec7de935b4683af9a3c7147ac2e9f13336254d3c7b740","content_hash_algorithm":"sha256","purpose":"fixed synthetic DAG declaration","ref_type":"dag_config","relative_path":"examples/execution_contract/synthetic_run/youtube_truthfulness_dag_v1_1.yaml"},{"content_hash":"93218772b4d3d0132831738c06e37f70d5b02f16ecfd1a3c219dfb6ce01e27d7","content_hash_algorithm":"sha256","purpose":"fixed run Registry historical prefix","ref_type":"registry","relative_path":"examples/execution_contract/synthetic_run/artifact_registry.jsonl"}],"checkpoint_hash":"abd1c51ab81a4988ecc133268af94003d26004a4cbbfeaadb43ccb8708e6cb7f","checkpoint_id":"checkpoint_01j00000000000000000000000","checkpoint_kind":"stage_boundary","checkpoint_schema_version":"execution_checkpoint_v1.0.0","code_ref":{"git_commit":"8c64bc910168e4212f081cdcc0ac2099738dcd3a","working_tree_dirty":true,"working_tree_manifest_hash":"47bba36d142f2ad1e7f406015d2117f8d720b971607016d3db21a44b7f02ded8","working_tree_manifest_path":"examples/execution_contract/synthetic_run/working_tree_manifest.json"},"created_at":"2026-01-01T00:00:08Z","dag_ref":{"content_hash":"e14161e9824f479d806ec7de935b4683af9a3c7147ac2e9f13336254d3c7b740","content_hash_algorithm":"sha256","dag_id":"youtube_truthfulness_dag","dag_version":"youtube_truthfulness_dag_v1.1.0","relative_path":"examples/execution_contract/synthetic_run/youtube_truthfulness_dag_v1_1.yaml","workflow_version":"youtube_truthfulness_workflow_v1.1.0"},"event_head":{"event_hash":"1f23e23354e03d861ce7a1dd98f671d1ecdbe489c44323ba5a98c756fdcec49f","event_id":"event_01j00000000000000000000007","occurred_at":"2026-01-01T00:00:07Z","sequence_no":7},"input_artifacts":[{"artifact_id":"artifact_01j00000000000000000000001","artifact_type":"synthetic.input","content_hash":"def81af2ea85a2bb3ce0c0e49607aeccceb25734ad5b64cf978b6697d0a56c75","content_hash_algorithm":"sha256","input_fingerprint":null,"lifecycle_state":"validated","record_id":"record_01j00000000000000000000001","relative_path":"examples/execution_contract/synthetic_run/artifacts/input.json","validation_status":"passed"}],"invalidated_artifacts":[],"output_artifacts":[{"artifact_id":"artifact_01j00000000000000000000002","artifact_type":"synthetic.output","content_hash":"94c42a41e538829a75fa1cab004620b00f7cb36a7c315dba4bb2f93c6856853a","content_hash_algorithm":"sha256","input_fingerprint":null,"lifecycle_state":"validated","record_id":"record_01j00000000000000000000002","relative_path":"examples/execution_contract/synthetic_run/artifacts/output.json","validation_status":"passed"}],"parent_checkpoint_id":null,"project_version":"v0.2","prompt_version":"s01_prompt_v1.0.0","registry_heads":[{"artifact_count":2,"content_hash":"93218772b4d3d0132831738c06e37f70d5b02f16ecfd1a3c219dfb6ce01e27d7","content_hash_algorithm":"sha256","head_record_hash":"f0bece856870ae708c590039746da6ff0dd2f9f24475f34e9c53d52d5d6f2bba","head_record_id":"record_01j00000000000000000000002","record_count":2,"registry_scope":"run","relative_path":"examples/execution_contract/synthetic_run/artifact_registry.jsonl"}],"release_id":"truthfulness_v0.2_youtube_video","run_id":"run_01j00000000000000000000000","schema_versions":["artifact_record_v1.1.0","current_state_v1.0.0","execution_checkpoint_v1.0.0","execution_event_v1.0.0","handoff_v2.0.0","session_manifest_v1.0.0"],"session_id":"session_01j00000000000000000000000","stage_id":"S01","state_hash":"fe43eff8708ccdf4795679bc402e2d2a55aca1c28dbb0353fc34a93a2e62ddf1","storage_version":"V02","task_id":"task_01j00000000000000000000000","terminal_state":"COMPLETED","validation_summary":{"failed_count":0,"overall_status":"passed","partial_count":0,"passed_count":1,"validators":[{"result":"passed","validation_artifact_id":null,"validator_id":"synthetic.schema","validator_version":"1.0.0"}]},"workflow_version":"youtube_truthfulness_workflow_v1.1.0"}
